<?xml version="1.0" encoding="UTF-8"?>

<coreServerEntity xmlns="aaacs.coreserver/generation"
	xmlns:xsi="http://www.w3.org/2001/XMLSchema-instance"
	xsi:schemaLocation="aaacs.coreserver/generation ../../schemas/csDocEntity.xsd">
	
	<table>
		<name>tOccupations</name>
		<constraints>
			<unique>name</unique>
		</constraints>
	</table>

	<cache/>

	<class>
		<name>Occupation</name>
		<import>aaacs.coreserver.ejb.entities.support.CacheManager</import>
		<annotations>
			<entity/>
			<sqlResultSetMappings>
				<standardMapping/>
			</sqlResultSetMappings>
		</annotations>
	</class>

	<attributes>
		<includeAttributes>conf/generation/descriptors/standardAttributes.xml</includeAttributes>

		<attribute>
			<columnDescription name="name" type="VARCHAR(100)">
				<notNull/>
			</columnDescription>
			<javaFieldDescription name="name" type="String">
				<annotations><basic/></annotations>
				<validation>
					<String>
						<allowNull>false</allowNull>
						<minLength>1</minLength>
						<maxLength>100</maxLength>
					</String>
				</validation>
				<dto cacheLookup="true"/>
			</javaFieldDescription>
		</attribute>

	</attributes>

	<populate>
		<defaults>
			<columnValues>
			name 'string.Default'
			</columnValues>
		</defaults>
		<insert>
			<columnValues>
			idk '1'
			name 'string.Unset'
			</columnValues>
		</insert>
		<insert>
			<columnValues>
			idk '101'
			</columnValues>
		</insert>
		<insert>
			<columnValues>
			idk '102'
			name 'string.Unknown'
			</columnValues>
		</insert>
		<insert>
			<columnValues>
			idk '103'
			name 'string.Nonexistent'
			</columnValues>
		</insert>
		<insert>
			<columnValues>
			idk '901'
			name 'string.MatchAll'
			</columnValues>
		</insert>
		<insert>
			<columnValues>
			idk '902'
			name 'string.MatchReserved'
			</columnValues>
		</insert>
		<insert>
			<columnValues>
			idk '903'
			name 'string.MatchUser'
			</columnValues>
		</insert>
		<insert>
			<columnValues>
			name 'occupation.Administration'
			</columnValues>
		</insert>
		<insert>
			<columnValues>
			name 'occupation.Banking'
			</columnValues>
		</insert>
		<insert>
			<columnValues>
			name 'occupation.Education'
			</columnValues>
		</insert>
		<insert>
			<columnValues>
			name 'occupation.Engineering'
			</columnValues>
		</insert>
		<insert>
			<columnValues>
			name 'occupation.Farming'
			</columnValues>
		</insert>
		<insert>
			<columnValues>
			name 'occupation.HealthCare'
			</columnValues>
		</insert>
		<insert>
			<columnValues>
			name 'occupation.Homemaking'
			</columnValues>
		</insert>
		<insert>
			<columnValues>
			name 'occupation.InformationTechnology'
			</columnValues>
			<store>occupationInformationTechnology</store>
		</insert>
		<insert>
			<columnValues>
			name 'occupation.Law'
			</columnValues>
		</insert>
		<insert>
			<columnValues>
			name 'occupation.Military'
			</columnValues>
		</insert>
		<insert>
			<columnValues>
			name 'occupation.Other'
			</columnValues>
		</insert>
		<insert>
			<columnValues>
			name 'occupation.RealEstate'
			</columnValues>
		</insert>
		<insert>
			<columnValues>
			name 'occupation.Science'
			</columnValues>
		</insert>
		<insert>
			<columnValues>
			name 'occupation.Trade'
			</columnValues>
		</insert>
	</populate>

</coreServerEntity>
